{
  "tool_id": "twilio/messaging-api",
  "status": "verified",
  "reviewed_by": "registry-moderator",
  "reviewed_at": "2026-03-08T00:00:00Z",
  "evidence": {
    "official_docs_url": "https://www.twilio.com/docs/messaging/api/message-resource",
    "external_references": [
      "https://www.twilio.com/docs/usage/requests-to-twilio",
      "https://www.twilio.com/docs/messaging/api",
      "https://www.twilio.com/en-us/pricing/messaging"
    ],
    "notes": "Manual review confirmed Twilio first-party docs for Messaging Message resource endpoints, REST authentication guidance, and official pricing documentation."
  }
}
